{
  "schema_version": "1.0.0",
  "evidence_contract_version": "1.0.0",
  "canonical_mpn": "ZMM4V3",
  "manufacturer": "HXY MOSFET",
  "description": "1 Independent 1uA 4.3V 4V~4.6V 500mW 600Ω 75Ω LL-34 Zener Diodes ROHS",
  "electrical_family": "diode",
  "symbol_pins": [
    {
      "name": "A",
      "number": "1",
      "role": "anode"
    },
    {
      "name": "K",
      "number": "2",
      "role": "cathode"
    }
  ],
  "spice_pin_mapping": [
    {
      "symbol_pin_number": "1",
      "subckt_node": "anode",
      "order": 1
    },
    {
      "symbol_pin_number": "2",
      "subckt_node": "cathode",
      "order": 2
    }
  ],
  "package_variants": [
    {
      "name": "LL-34",
      "standard": "LL-34",
      "pin_count": 2,
      "pin_map": [
        {
          "package_pin": "1",
          "symbol_pin_number": "1"
        },
        {
          "package_pin": "2",
          "symbol_pin_number": "2"
        }
      ]
    }
  ],
  "ordering_code_aliases": [],
  "datasheet": {
    "url": "https://jlcpcb.com/api/file/downloadByFileSystemAccessId/8590905684349165568",
    "revision": "revision not stated in source"
  },
  "model_type": "dot_model",
  "fidelity_tier": "F1",
  "domain_coverage": {
    "dc": "approx",
    "ac": "none",
    "transient": "none",
    "noise": "none",
    "thermal": "none",
    "digital": "none"
  },
  "supported_analyses": [
    "operating_point",
    "dc_sweep"
  ],
  "supported_operating_region": {
    "contract_version": "1.0.0",
    "summary": "Supported only over the direct cited diode forward-evidence union: forward_current 0.1 to 0.1 A; forward_voltage 1 to 1 V; temperature 25 to 25 degC.",
    "numeric_bounds": [
      {
        "bound_id": "sha256:019ce5a3339097f951a2292f64084d10ba5c5bc622c4cb7f6854bce23004e95d",
        "quantity": "forward_current",
        "kind": "range",
        "unit": "A",
        "minimum": 0.1,
        "maximum": 0.1,
        "evidence_refs": [
          {
            "evidence_id": "sha256:59fff2dad71c9c8da127736b988db0a00cfc98dc0304bb193147aae5ccb728fd",
            "condition_id": "sha256:182870692370c7d5394b2f90caff86694a7be90bba639b5c204a840321e2e94d",
            "citation_id": "sha256:810773dbc615fb1ef3840d24099562be9ed001f9eb9b8829eef0718874285cc9",
            "cohort_id": "sha256:33473f05f6fdf9a4141d3e7f249024356232df77d0089c5cffd0d9b86bd99fd7"
          }
        ],
        "condition_ids": [
          "sha256:182870692370c7d5394b2f90caff86694a7be90bba639b5c204a840321e2e94d"
        ],
        "citation_ids": [
          "sha256:810773dbc615fb1ef3840d24099562be9ed001f9eb9b8829eef0718874285cc9"
        ],
        "derivation": "direct_evidence_union",
        "conditions": "Direct cited diode forward-evidence union",
        "placeholder": false
      },
      {
        "bound_id": "sha256:22be9940275f9591479a6c012fedfcd2a08eda79dc851b9a17dbfed245dbb9ed",
        "quantity": "forward_voltage",
        "kind": "range",
        "unit": "V",
        "minimum": 1,
        "maximum": 1,
        "evidence_refs": [
          {
            "evidence_id": "sha256:b5318cb765dbfb905a297a9a0747963e6c70af70c9bd9258b3eb5e3862f01a10",
            "condition_id": "sha256:c7dfa47a78f305a1d9e1a1c069bbb254aafcd0ad77d898da6da878682adb0513",
            "citation_id": "sha256:1815ceb4ee095790e81b9a5c144490d87996a0d401bb01b8541dbcaccb7aff34",
            "cohort_id": "sha256:02e5fd261b89407d935df6437d40d96c4d81f36b156d4f05c30e03f49d241e68"
          }
        ],
        "condition_ids": [
          "sha256:c7dfa47a78f305a1d9e1a1c069bbb254aafcd0ad77d898da6da878682adb0513"
        ],
        "citation_ids": [
          "sha256:1815ceb4ee095790e81b9a5c144490d87996a0d401bb01b8541dbcaccb7aff34"
        ],
        "derivation": "direct_evidence_union",
        "conditions": "Direct cited diode forward-evidence union",
        "placeholder": false
      },
      {
        "bound_id": "sha256:0cb622018ca8ebbf7266518b1a8803b8dc442265c247cc5003683f1616b830e8",
        "quantity": "temperature",
        "kind": "range",
        "unit": "degC",
        "minimum": 25,
        "maximum": 25,
        "evidence_refs": [
          {
            "evidence_id": "sha256:59fff2dad71c9c8da127736b988db0a00cfc98dc0304bb193147aae5ccb728fd",
            "condition_id": "sha256:182870692370c7d5394b2f90caff86694a7be90bba639b5c204a840321e2e94d",
            "citation_id": "sha256:810773dbc615fb1ef3840d24099562be9ed001f9eb9b8829eef0718874285cc9",
            "cohort_id": "sha256:33473f05f6fdf9a4141d3e7f249024356232df77d0089c5cffd0d9b86bd99fd7"
          },
          {
            "evidence_id": "sha256:b5318cb765dbfb905a297a9a0747963e6c70af70c9bd9258b3eb5e3862f01a10",
            "condition_id": "sha256:c7dfa47a78f305a1d9e1a1c069bbb254aafcd0ad77d898da6da878682adb0513",
            "citation_id": "sha256:1815ceb4ee095790e81b9a5c144490d87996a0d401bb01b8541dbcaccb7aff34",
            "cohort_id": "sha256:02e5fd261b89407d935df6437d40d96c4d81f36b156d4f05c30e03f49d241e68"
          }
        ],
        "condition_ids": [
          "sha256:182870692370c7d5394b2f90caff86694a7be90bba639b5c204a840321e2e94d",
          "sha256:c7dfa47a78f305a1d9e1a1c069bbb254aafcd0ad77d898da6da878682adb0513"
        ],
        "citation_ids": [
          "sha256:1815ceb4ee095790e81b9a5c144490d87996a0d401bb01b8541dbcaccb7aff34",
          "sha256:810773dbc615fb1ef3840d24099562be9ed001f9eb9b8829eef0718874285cc9"
        ],
        "derivation": "direct_evidence_union",
        "temperature_kind": "ambient",
        "conditions": "Direct cited diode forward-evidence union",
        "placeholder": false
      }
    ]
  },
  "known_omissions": [
    "AC, transient, noise, thermal, and package-parasitic behavior are outside this DC-only conveyor package.",
    "Temperature dependence and self-heating are not modelled; each electrical claim is limited to its exact cited bench temperature.",
    "Catalog parametrics may be recorded only as optimizer seeds; they are not evidence, constraints, residual targets, or datasheet citations.",
    "F2 evidence did not qualify; staged as F1: Table-only extraction.",
    "Table-only extraction."
  ],
  "licence": {
    "spdx_id": "MIT",
    "provenance_basis": "original_from_facts"
  },
  "generator": {
    "tool_or_agent": "opencircuit-model-factory-v0.1.0 bulk-adapter evidence-contract-1.0.0",
    "date": "2026-08-23"
  },
  "reviewer": {
    "tool_or_agent": "gpt-5.6-terra independent package reviewer",
    "date": "2026-08-23"
  },
  "test_results": {
    "status": "complete",
    "pass_count": 1,
    "fail_count": 0,
    "total_count": 1,
    "worst_observed_relative_fitting_error": {
      "value": 0,
      "quantity": "package expectation"
    }
  },
  "validation_date": "2026-08-23"
}
